<?xml version="1.0" encoding="UTF-8"?>
<lista_korisnika
        xmlns="http://www.ftn.uns.ac.rs/xml_i_veb_servisi/korisnik"
        xmlns:xsi="http://www.w3.org/2001/XMLSchema-instance"
        xsi:schemaLocation="http://www.ftn.uns.ac.rs/xml_i_veb_servisi/korisnik ../schema/korisnik.xsd"
        >

    <korisnik>
        <ime_i_prezime>Gradjanin Gradjanic</ime_i_prezime>
        <email>gradjanin@maildrop.cc</email>
        <lozinka>$2a$10$O3kSN7IVySPBM7BTlgVOfu9toOubgKYYrjywtwdUWgSxKPYSBd6YO</lozinka>
        <uloga>G</uloga>
    </korisnik>

    <korisnik>
        <ime_i_prezime>Gradjica Gradjic</ime_i_prezime>
        <email>gradjica@maildrop.cc</email>
        <lozinka>$2a$10$V/4xHn/Ej9wX6rblKO2YuOZuGFi6JnifSte4j2Zg0znWugF0HGG3W</lozinka>
        <uloga>G</uloga>
    </korisnik>

    <korisnik>
        <ime_i_prezime>Zdravstveni Radnik</ime_i_prezime>
        <email>zradnik@maildrop.cc</email>
        <lozinka>$2a$10$lR.P3q9TUo42.EYgMTInleGQz4WYbkn12MoG0SYJwo69GYg3lOD9S</lozinka>
        <uloga>Z</uloga>
    </korisnik>
</lista_korisnika>