<?xml version="1.0" encoding="UTF-8"?>
<lista_korisnika
        xmlns="http://www.ftn.uns.ac.rs/xml_i_veb_servisi/korisnik"
        xmlns:xsi="http://www.w3.org/2001/XMLSchema-instance"
        xsi:schemaLocation="http://www.ftn.uns.ac.rs/xml_i_veb_servisi/korisnik ../schema/korisnik.xsd"
        >

    <korisnik>
        <ime_i_prezime>Sluzbenik Sluzbenikic</ime_i_prezime>
        <email>sluzbenik@maildrop.cc</email>
        <lozinka>$2a$10$N5MZtCigIDUN30U0Gfs3Eu.uGTcD21l63RfGreGXD/CIiS.VokrLm</lozinka>
        <uloga>S</uloga>
    </korisnik>

    <korisnik>
        <ime_i_prezime>Sluzbenica Sluzbenikic</ime_i_prezime>
        <email>sluzbenica@maildrop.cc</email>
        <lozinka>$2a$10$lMyYkPcWPKY2gn/WRoZ8WOZFwwSVAeO9YpFGQAoJrEqowq2aZxTN2</lozinka>
        <uloga>S</uloga>
    </korisnik>

</lista_korisnika>